{
  "version": 1,
  "id": "9037a57c-c501-44e6-8f1a-56f4c9317695",
  "createdAt": "2026-10-27T10:00:00Z",
  "title": "Synthetic native session fixture",
  "source": "macos",
  "state": "completed",
  "tracks": [
    {
      "id": "microphone",
      "label": "Microphone",
      "kind": "microphone",
      "file": "track-microphone.wav",
      "sampleRate": 8000,
      "channels": 1,
      "startOffsetMs": 0,
      "endOffsetMs": 1000,
      "frames": 8000,
      "ended": true,
      "labelSource": "device"
    },
    {
      "id": "system",
      "label": "System output",
      "kind": "system",
      "file": "track-system.wav",
      "sampleRate": 8000,
      "channels": 2,
      "startOffsetMs": 125,
      "endOffsetMs": 1125,
      "frames": 8000,
      "ended": true,
      "labelSource": "device"
    }
  ]
}
